[
  {
    "id": "manner_itadakimasu",
    "language": "ja",
    "level": "N5",
    "skill": "culture",
    "type": "sentence",
    "title": "Câu nói trước khi ăn (いただきます)",
    "content": {
      "vi": "Câu nói trước khi ăn",
      "ja": "いただきます (Itadakimasu)",
      "ja_kanji": "",
      "ja_kana": "いただきます",
      "en": "Expression said before eating; I humbly receive this meal.",
      "phonetic": "itadakimasu"
    },
    "source_id": "panda_kids_n5_curriculum",
    "stopwords_override": [],
    "review_status": "verified",
    "topic": "Manners",
    "keywords": [
      "mời ăn cơm",
      "chúc ngon miệng",
      "itadakimasu",
      "truoc khi an",
      "an com",
      "let's eat!",
      "いただきます",
      "頂きます",
      "いただきます (Itadakimasu)"
    ],
    "vi": "Câu nói trước khi ăn",
    "ja": "いただきます (Itadakimasu)",
    "ja_kanji": "",
    "ja_kana": "いただきます",
    "en": "Expression said before eating; I humbly receive this meal.",
    "phonetic": "itadakimasu"
  },
  {
    "id": "manner_gochisousama",
    "language": "ja",
    "level": "N5",
    "skill": "culture",
    "type": "sentence",
    "title": "Cảm ơn sau bữa ăn (ごちそうさまでした)",
    "content": {
      "vi": "Cảm ơn sau bữa ăn",
      "ja": "ごちそうさまでした (Gochisōsama deshita)",
      "ja_kanji": "ご馳走様でした",
      "ja_kana": "ごちそうさまでした",
      "en": "Thank you for the meal.",
      "phonetic": "gochisōsama deshita"
    },
    "source_id": "panda_kids_n5_curriculum",
    "stopwords_override": [],
    "review_status": "verified",
    "topic": "Manners",
    "keywords": [
      "cảm ơn sau khi ăn",
      "an xong",
      "gochisousama",
      "no roi",
      "cam on bua an",
      "thank you for the meal",
      "ごちそうさま",
      "ご馳走様",
      "ごちそうさまでした (Gochisōsama deshita)",
      "ご馳走様でした",
      "ごちそうさまでした",
      "ăn xong",
      "ăn rồi",
      "sau khi ăn",
      "ăn cơm xong",
      "ăn xong nói gì"
    ],
    "vi": "Cảm ơn sau bữa ăn",
    "ja": "ごちそうさまでした (Gochisōsama deshita)",
    "ja_kanji": "ご馳走様でした",
    "ja_kana": "ごちそうさまでした",
    "en": "Thank you for the meal.",
    "phonetic": "gochisōsama deshita"
  },
  {
    "id": "manner_gomennasai",
    "language": "ja",
    "level": "N5",
    "skill": "culture",
    "type": "sentence",
    "title": "Xin lỗi (ごめんなさい)",
    "content": {
      "vi": "Xin lỗi",
      "ja": "ごめんなさい (Gomennasai)",
      "ja_kanji": "",
      "ja_kana": "ごめんなさい",
      "en": "I am sorry",
      "phonetic": "gomennasai"
    },
    "source_id": "panda_kids_n5_curriculum",
    "stopwords_override": [],
    "review_status": "verified",
    "topic": "Manners",
    "keywords": [
      "xin lỗi",
      "gomen",
      "gomennasai",
      "loi lam",
      "sorry",
      "xin loi ban",
      "i am sorry",
      "ごめんなさい",
      "ご免なさい",
      "ごめんなさい (Gomennasai)",
      "xin lỗi tiếng nhật"
    ],
    "vi": "Xin lỗi",
    "ja": "ごめんなさい (Gomennasai)",
    "ja_kanji": "",
    "ja_kana": "ごめんなさい",
    "en": "I am sorry",
    "phonetic": "gomennasai"
  },
  {
    "id": "manner_ittekimasu",
    "language": "ja",
    "level": "N5",
    "skill": "culture",
    "type": "sentence",
    "title": "Chào đi học/ra ngoài (行ってきます (Ittekimasu))",
    "content": {
      "vi": "Chào đi học/ra ngoài",
      "ja": "行ってきます (Ittekimasu)",
      "ja_kanji": "行ってきます",
      "ja_kana": "いってきます",
      "en": "I'm leaving!",
      "phonetic": "ittekimasu"
    },
    "source_id": "panda_kids_n5_curriculum",
    "stopwords_override": [],
    "review_status": "verified",
    "topic": "Manners",
    "keywords": [
      "con đi học đây",
      "chào khi đi",
      "ittekimasu",
      "di hoc",
      "chao bo me",
      "chào đi học/ra ngoài",
      "i'm leaving!",
      "いってきます",
      "行ってきます",
      "行ってきます (Ittekimasu)"
    ],
    "vi": "Chào đi học/ra ngoài",
    "ja": "行ってきます (Ittekimasu)",
    "ja_kanji": "行ってきます",
    "ja_kana": "いってきます",
    "en": "I'm leaving!",
    "phonetic": "ittekimasu"
  },
  {
    "id": "manner_tadaima",
    "language": "ja",
    "level": "N5",
    "skill": "culture",
    "type": "sentence",
    "title": "Con về rồi (只今 (Tadaima))",
    "content": {
      "vi": "Con về rồi",
      "ja": "ただいま (Tadaima)",
      "ja_kanji": "只今",
      "ja_kana": "ただいま",
      "en": "I'm home!",
      "phonetic": "tadaima"
    },
    "source_id": "panda_kids_n5_curriculum",
    "stopwords_override": [],
    "review_status": "verified",
    "topic": "Manners",
    "keywords": [
      "con đã về rồi",
      "ve nha",
      "tadaima",
      "di hoc ve",
      "i'm home!",
      "ただいま",
      "只今",
      "ただいま (Tadaima)",
      "về đến nhà",
      "về tới nhà",
      "khi về tới nhà",
      "khi về nhà",
      "mới về nhà nói câu gì",
      "vừa về đến nhà",
      "về nhà nói gì",
      "ve den nha",
      "ve toi nha",
      "khi ve toi nha",
      "khi ve nha",
      "moi ve nha noi cau gi"
    ],
    "vi": "Con về rồi",
    "ja": "ただいま (Tadaima)",
    "ja_kanji": "只今",
    "ja_kana": "ただいま",
    "en": "I'm home!",
    "phonetic": "tadaima"
  },
  {
    "id": "manner_ohayou",
    "language": "ja",
    "level": "N5",
    "skill": "culture",
    "type": "sentence",
    "title": "Chào buổi sáng (おはようございます (Ohayou gozaimasu))",
    "content": {
      "vi": "Chào buổi sáng",
      "ja": "おはようございます (Ohayou gozaimasu)",
      "ja_kanji": "",
      "ja_kana": "おはようございます",
      "en": "Good morning",
      "phonetic": "ohayou gozaimasu"
    },
    "source_id": "shinjuku_city_easy_japanese_conversation_2021",
    "source_url": "https://www.foreign.city.shinjuku.lg.jp/en/wp-content/uploads/sites/3/2023/09/ShinjukuBook_jeck_202104.pdf",
    "stopwords_override": [],
    "review_status": "verified",
    "topic": "Manners",
    "keywords": [
      "chào buổi sáng",
      "chao buoi sang",
      "buổi sáng tiếng nhật",
      "chào buổi sáng tiếng nhật",
      "good morning",
      "ohayou gozaimasu",
      "ohayou",
      "おはようございます"
    ],
    "vi": "Chào buổi sáng",
    "ja": "おはようございます (Ohayou gozaimasu)",
    "ja_kanji": "",
    "ja_kana": "おはようございます",
    "en": "Good morning",
    "phonetic": "ohayou gozaimasu"
  },
  {
    "id": "manner_konnichiwa",
    "language": "ja",
    "level": "N5",
    "skill": "culture",
    "type": "sentence",
    "title": "Xin chào (こんにちは (Konnichiwa))",
    "content": {
      "vi": "Xin chào",
      "ja": "こんにちは (Konnichiwa)",
      "ja_kanji": "",
      "ja_kana": "こんにちは",
      "en": "Hello",
      "phonetic": "konnichiwa"
    },
    "source_id": "shinjuku_city_easy_japanese_conversation_2021",
    "source_url": "https://www.foreign.city.shinjuku.lg.jp/en/wp-content/uploads/sites/3/2023/09/ShinjukuBook_jeck_202104.pdf",
    "stopwords_override": [],
    "review_status": "verified",
    "topic": "Manners",
    "keywords": [
      "xin chào tiếng nhật",
      "chào hỏi bằng tiếng nhật",
      "chào ban ngày tiếng nhật",
      "hello in japanese",
      "hello",
      "konnichiwa",
      "こんにちは"
    ],
    "vi": "Xin chào",
    "ja": "こんにちは (Konnichiwa)",
    "ja_kanji": "",
    "ja_kana": "こんにちは",
    "en": "Hello",
    "phonetic": "konnichiwa"
  },
  {
    "id": "manner_konbanwa",
    "language": "ja",
    "level": "N5",
    "skill": "culture",
    "type": "sentence",
    "title": "Chào buổi tối (こんばんは (Konbanwa))",
    "content": {
      "vi": "Chào buổi tối",
      "ja": "こんばんは (Konbanwa)",
      "ja_kanji": "",
      "ja_kana": "こんばんは",
      "en": "Good evening",
      "phonetic": "konbanwa"
    },
    "source_id": "shinjuku_city_easy_japanese_conversation_2021",
    "source_url": "https://www.foreign.city.shinjuku.lg.jp/en/wp-content/uploads/sites/3/2023/09/ShinjukuBook_jeck_202104.pdf",
    "stopwords_override": [],
    "review_status": "verified",
    "topic": "Manners",
    "keywords": [
      "chào buổi tối",
      "chao buoi toi",
      "buổi tối tiếng nhật",
      "chào buổi tối tiếng nhật",
      "buổi tối gặp nhau chào gì",
      "good evening",
      "konbanwa",
      "こんばんは"
    ],
    "vi": "Chào buổi tối",
    "ja": "こんばんは (Konbanwa)",
    "ja_kanji": "",
    "ja_kana": "こんばんは",
    "en": "Good evening",
    "phonetic": "konbanwa"
  },
  {
    "id": "manner_self_introduction",
    "language": "ja",
    "level": "N5",
    "skill": "conversation",
    "type": "sentence",
    "title": "Tự giới thiệu ngắn bằng tiếng Nhật",
    "content": {
      "vi": "Rất vui được gặp bạn. Tôi là [tên], đến từ [quốc gia/thành phố]. Rất mong được làm quen với bạn.",
      "ja": "はじめまして。[名前]です。[国／町]から来ました。（どうぞ）よろしくお願いします。",
      "ja_kanji": "はじめまして。[名前]です。[国／町]から来ました。（どうぞ）よろしくお願いします。",
      "ja_kana": "はじめまして。[なまえ]です。[くに／まち]からきました。（どうぞ）よろしくおねがいします。",
      "en": "Nice to meet you. I'm [name], from [country/city]. I look forward to getting to know you.",
      "phonetic": "hajimemashite. [namae] desu. [kuni/machi] kara kimashita. (douzo) yoroshiku onegaishimasu"
    },
    "source_id": "shinjuku_city_easy_japanese_conversation_2021",
    "source_url": "https://www.irodori.jpf.go.jp/assets/data/starter/pdf/X_L03.pdf",
    "stopwords_override": [],
    "review_status": "verified",
    "topic": "Self-introduction",
    "keywords": [
      "giới thiệu bản thân",
      "tự giới thiệu bằng tiếng nhật",
      "giới thiệu tên bằng tiếng nhật",
      "hướng dẫn giới thiệu bản thân",
      "mẫu giới thiệu bản thân tiếng nhật",
      "tên tôi là tiếng nhật",
      "nói tên mình bằng tiếng nhật",
      "my name is",
      "hajimemashite",
      "はじめまして",
      "自己紹介",
      "自分の名前"
    ],
    "vi": "Rất vui được gặp bạn. Tôi là [tên], đến từ [quốc gia/thành phố]. Rất mong được làm quen với bạn.",
    "ja": "はじめまして。[名前]です。[国／町]から来ました。（どうぞ）よろしくお願いします。",
    "ja_kanji": "はじめまして。[名前]です。[国／町]から来ました。（どうぞ）よろしくお願いします。",
    "ja_kana": "はじめまして。[なまえ]です。[くに／まち]からきました。（どうぞ）よろしくおねがいします。",
    "en": "Nice to meet you. I'm [name], from [country/city]. I look forward to getting to know you.",
    "phonetic": "hajimemashite. [namae] desu. [kuni/machi] kara kimashita. (douzo) yoroshiku onegaishimasu"
  },
  {
    "id": "manner_okaeri",
    "language": "ja",